qid,original_question,suggested_rewritten_question,question_type,difficulty,doc_id,page_id,page_number,chunk_id,evidence_text,evidence_text_short,years_detected,entities_detected,extraction_method,quality_flag,ocr_needed,proposed_answer,keep_for_benchmark,relevance,verified,labeler,notes
Q0048,Tài liệu mô tả sự kiện hoặc nội dung gì liên quan đến năm 1945?,"Năm 1945, tài liệu nêu sự kiện hoặc nội dung gì liên quan đến Liên Xô?",fact_date,easy,D010,D010_P0020,20,D010_C0013,"[Page 20]
LỊCH SỬ VIỆT NAM - TẬP 10
đã thi hành chính sách đổi nội, đối ngoại vừa mềm dẻo, lỉnh hoạt 
vừa nguyên tắc, kiên định đã tùng bước thay đoi được tương quan 
lực lượng và giành được những thắng lợi rất quan trọng có ý nghĩa 
rất quyết định. Sự kiện Trung Quốc, Liên Xô và các nước dân chù 
nhân dân khác công nhận nền độc lập cùa Việt Nam, đặt quan hệ 
ngoại giao với nước Việt Nam dân chù cộng hòa vào đầu năm 
1950, đặc biệt là Chiến thắng Biên giới Thu - Đông năm 1950 đập 
tan các căn cứ chiếm đóng của địch, khai thông vùng căn cứ địa 
Việt Bắc với the giới bên ngoài đã chấm dứt tình trạng bị cô lập 
cùa nước Việt Nam dân chủ cộng hòa. Một cục diện mới (về chính 
trị, quân sự, ngoại giao...) đã mở ra. Do đó, không chi phía Việt 
Nam dân chù cộng hòa có sự chuyển hướng trong đường loi chì 
đạo kháng chiến, mà cả phía Pháp với nguỵ quyển, nguỵ quân cũng 
đã phải để ra những đối sách mới để ứng phó với tình hình mới. Từ 
tháng 8/1945 đến cuối năm 1950, 13 đời Thủ tướng Pháp với nhiều 
kế hoạch xâm lược Việt Nam như Ke hoạch D'Argenlieu, Ke hoạch 
Leclerc, Ke hoạch Revers đã không xoay chuyển được tình hình và 
cuối năm 1950 phải chuyển sang một ké hoạch mới do Turómg De 
Lattre de Tassigny, Cao uỷ Tổng chi huy quân đội Pháp ở Đông 
Dương phụ trách.
Như vậy là đến cuối năm ỉ950, cả hai lực lượng song song tồn 
tại ở Việt Nam (lực lượng cùa nước Việt Nam dân chù cộng hòa - 
một ntỉớc đã được phe xã hội chù nghĩa công nhận và lực lượng 
thân Pháp đang được một sổ nước đế quốc như Mỹ, Anh ùng hộ) 
đều chuyển sang một giai đoạn mới trong cuộc đấu tranh một mất 
một còn để giành giật vai trò là người đại diện đích thực trên đất 
nước Việt Nam.
Giai đoạn lịch sử 1945-1950 chứa đựng nhiều sự kiện, nhiều 
vấn đề nhưng chưa được nghiên cứu một cách toàn diện và đầy đù. 
Cho đến nay, những công trình của các sử gia Việt Nam nghiên 
cứu ""phía bên kia"" một cách thật sự sâu sắc còn ít. Khôi phục lại 
một cách chân thực, khách quan diện mạo cùa Việt Nam bằng cách 
nhìn tổng thể, toàn diện cả hai phía là rất cần thiết đối với việc
20","[Page 20] LỊCH SỬ VIỆT NAM - TẬP 10 đã thi hành chính sách đổi nội, đối ngoại vừa mềm dẻo, lỉnh hoạt vừa nguyên tắc, kiên định đã tùng bước thay đoi được tương quan lực lượng và giành được những thắng lợi rất quan trọng có ý nghĩa rất quyết định. Sự kiện Trung Quốc, Liên Xô và các nước dân chù nhân dân khác công nhận nền độc lập cùa Việt Nam, đặt quan hệ ngoại giao với nước Việt Nam dân chù cộng hòa vào đầu năm 1950, đặc biệt là Chiến thắng Biên giới Thu - Đông năm 1950 đập tan các căn cứ chi...",1945|1950,Liên Xô|Việt Nam|Việt Bắc|Turómg De Lattre|Đông Dương|kháng chiến|độc lập,pymupdf,clean_text,false,"Sự kiện Trung Quốc, Liên Xô và các nước dân chù",false,0,false,,Candidate evidence only; set relevance=1 only after manual verification.|manual review required
Q0002,Vai trò hoặc hành động của Việt Nam được tài liệu mô tả như thế nào?,Tài liệu mô tả vai trò hoặc hành động của Việt Nam như thế nào?,person_entity,medium,D001,D001_P0021,21,D001_C0012,"[Page 21]
LỜI NÓI ĐÀU
Trước nhu cầu của xã hội cần có một bộ sử Việt Nam đầy đủ 
và phong phú; năm 2002, Viện Sừ học đã xác lập một kế hoạch 
khoa học (Chương trình trọng điểm cấp Bộ được Viện Khoa học 
xã hội Việt Nam phê duyệt) biên soạn bộ Lịch sử Việt Nam 15 tập, 
từ khởi thủy đến ngày nay. Với một yêu cầu nâng cao hơn chất 
lượng và phương pháp nghiên cứu, sách Lịch sử Việt Nam từ 
khởi thủy đến thế kỳ X do nhóm chúng tôi biên soạn nằm trong 
chương trình đó.
Quá trình tiến hành đề tài Lịch sử Việt Nam từ khới thủy đến 
thế kỳ X vốn đặt ra quá nhiều vấn đề đòi hỏi nhóm nghiên cứu cần 
góp phần làm sáng tỏ. Khó khăn gai góc đầu tiên mà chúng tôi đối 
diện chính là những sự kiện lịch sử của con người thời tiền sử và sơ 
sử diễn ra trên một địa bàn mà cương vực chưa được xác định rõ 
ràng như nước ta ngày nay; theo một trục thời gian quá dài hàng mấy 
chục vạn năm, có khi sai số tới cả ngàn năm!
Liên quan đến thời kỳ này, các van tự ghi chép vô cùng ÍL Thời kỳ 
nguyên thủy chưa có tư liệu chữ viết, khi nghiên cứu hoàn toàn 
phải dựa vào tư liệu khảo cổ học (tư liệu không biết nói), cổ sinh 
học... Thời lcỳ Hùng Vương dựng nước, nhóm nghiên cứu tuy có dựa 
vào truyền thuyết, nhưng lại là của người đời sau ghi chép, sáng tác. 
Thòi kỳ Bắc thuộc, tư liệu chữ Hán cổ cũng rất tản mạn, nghèo nàn; 
đôi khi thiếu độ tin cậy, khách quan.
Từ trước đến nay có nhiều người nghiên cứu lịch sử Việt Nam 
từ khởi thủy đến thế kỷ X và có nhiều công trinh đã được công bố. 
Chính từ các công trình đó, nhiều vấn đề lịch sử được đánh giá 
khách quan, nhất quán. Nhưng vẫn còn quá nhiều vấn đề gây tranh cãi;
19","[Page 21] LỜI NÓI ĐÀU Trước nhu cầu của xã hội cần có một bộ sử Việt Nam đầy đủ và phong phú; năm 2002, Viện Sừ học đã xác lập một kế hoạch khoa học (Chương trình trọng điểm cấp Bộ được Viện Khoa học xã hội Việt Nam phê duyệt) biên soạn bộ Lịch sử Việt Nam 15 tập, từ khởi thủy đến ngày nay. Với một yêu cầu nâng cao hơn chất lượng và phương pháp nghiên cứu, sách Lịch sử Việt Nam từ khởi thủy đến thế kỳ X do nhóm chúng tôi biên soạn nằm trong chương trình đó. Quá trình tiến hành đề tài Lịch sử...",2002,Việt Nam|Viện Sừ|Viện Khoa|Hùng Vương,pymupdf,clean_text,false,Trước nhu cầu của xã hội cần có một bộ sử Việt Nam đầy đủ,false,0,false,,Candidate evidence only; set relevance=1 only after manual verification.|manual review required
Q0008,Vai trò hoặc hành động của Nam Chiếu được tài liệu mô tả như thế nào?,Tài liệu mô tả vai trò hoặc hành động của Nam Chiếu như thế nào?,person_entity,medium,D002,D002_P0020,20,D002_C0013,"[Page 20]
Chương I. Bước quá độ từ thỉri kỳ mất nước..
chặn không cho quân Nam Chiếu tiến sâu vào nội địa Trung Quốc, 
nên đã bỏ mặc An Nam cho quân Nam Chiếu chiếm giữ. Quân 
Nam Chiếu tiến vào bao vây phủ thành Tống Bình - trị sở của chính 
quyền đô hộ nhà Đường lúc đó. Thái Tập - viên quan coi giữ thành 
cùa nhà Đường chống giữ không nổi, để thành bị phá (năm 863), 
gia quyến của Thái Tập có đến 70 người bị chết, Thái Tập liều 
mạng bò chạy ra thuyền nhưng không kịp, cuối cùng bị chết đuối1. 
Thừa thắng, quân Nam Chiếu chia nhau đóng giữ các nơi, đốt phá 
nhiều nhà cửa và giết hại nhiều dân sống trong khu vực thành Tống 
Bình. Chỉ trong hai lần đánh xuống An Nam, quân Nam Chiếu đã 
giết hại tới 15 vạn người2 dân vô tội.
Cuộc chiến tranh giằng co nhiều lần giữa chính quyền đô hộ nhà 
Đường và quân Nam Chiếu trên đất nước ta không những đã gây ra 
bao thảm cảnh cho nhân dân ta mà còn làm thương vong khá nhiều 
quân đội cùa nhà Đường, đó chính là những người dân Bắc quốc vô 
tội phải sung vào đội quân đi tiêu diệt quân Nam Chiếu. Những 
thương vong mà nhân dân hai nước phải gánh chịu trong cuộc 
chiến giữa nhà Đường và Nam Chiểu lúc đó, trách nhiệm hoàn toàn 
thuộc về chính quyền phong kiến nhà Đường.
Sau khi chiếm được An Nam, tướng Dương Tư Tấn3 của Nam 
Chiếu được cử ờ lại cùng với 2 vạn quân, còn quan lại và tướng sĩ 
nhà Đường ở An Nam thì đều tháo chạy về nước. Sau đó, theo dự 
đoán của vua quan nhà Đường, quân Nam Chiếu đã tiếp tục mở 
cuộc tiến công sang xâm lược miền Tả giang và Hữu giang, gần sát 
tới vùng châu Ung (Nam Ninh).
ở nước ta, vào tháng 6 năm 863, nhà Đường bò An Nam đô hộ 
phủ, đặt Hành Giao châu ở Hải Môn trấn (Liêm châu, Quảng 
Đông). Nhưng mới đuợc một tháng thì nhà Đường lại đặt An Nam 
đô hộ phủ ở Hành Giao châu4. Đầu năm 864, nhà Đường cử 
Truơng Nhân đem quân sang chiếm lại và coi việc An Nam. Nhung
1, 2, 3. Cao Hùng Trưng, An Nam chí nguyên, quyển 2, bản dịch đánh máy
Viện Sử học, tr. 27.
4. Cao Hùng Trưng, An Nam chí nguyên, quyển 2, sđd, tr. 27 - 28.","[Page 20] Chương I. Bước quá độ từ thỉri kỳ mất nước.. chặn không cho quân Nam Chiếu tiến sâu vào nội địa Trung Quốc, nên đã bỏ mặc An Nam cho quân Nam Chiếu chiếm giữ. Quân Nam Chiếu tiến vào bao vây phủ thành Tống Bình - trị sở của chính quyền đô hộ nhà Đường lúc đó. Thái Tập - viên quan coi giữ thành cùa nhà Đường chống giữ không nổi, để thành bị phá (năm 863), gia quyến của Thái Tập có đến 70 người bị chết, Thái Tập liều mạng bò chạy ra thuyền nhưng không kịp, cuối cùng bị chết đuối1. Thừ...",863|864,Nam Chiếu|An Nam|Quân Nam Chiếu|Tống Bình|Thái Tập|Nam Chiểu|Dương Tư|Hành Giao|Hải Môn|Truơng Nhân|Cao Hùng|Viện Sử,pymupdf,clean_text,false,"chặn không cho quân Nam Chiếu tiến sâu vào nội địa Trung Quốc,",false,0,false,,Candidate evidence only; set relevance=1 only after manual verification.|manual review required
Q0014,Vai trò hoặc hành động của Tây Son được tài liệu mô tả như thế nào?,Tài liệu mô tả vai trò hoặc hành động của Tây Son như thế nào?,person_entity,medium,D004,D004_P0020,20,D004_C0012,"[Page 20]
LỜI NÓI ĐẦU
Lịch sử Việt Nam, tập 4: từ thế kỷ XVII đến thế kỷ XVIII là
cuốn thứ 4 trong bộ thông sử nhiều tập, tiếp theo cuốn thứ 3 - Lịch 
sừ Việt Nam, tập 3: từ thể kỳ XV đen thể kỷ XVI. Cuốn này được bắt 
đầu từ sau sự kiện triều Mạc bị đổ (1592) đến hết triều Tây Son 
(1802), trước triều Nguyễn. Đây là tập sách viết về toàn bộ diễn 
biến lịch sù của đất nước trên các mặt: chính trị - xã hội, kinh tế và 
văn hóa trong hai thế kỷ XVII và XVIII.
Thế kỷ XVII-XVIII là giai đoạn lịch sù tương đối đặc biệt Uong 
tiến trình phát triển của lịch sù Việt Nam thời cổ Trung đại. Đó là 
thời kỳ chiến tranh phân liệt giữa các tập đoàn phong kiến, thời kỳ 
đất nước bị chia cắt làm hai miền với hai chế độ chính trị khác nhau: 
vua Lê - chúa Trịnh ở Đàng Ngoài và chúa Nguyễn ở Đàng Trong, 
hình thành nên một thể chế lưỡng đầu; Vua và Chúa cùng điều hành 
chính sự - sản phẩm đặc biệt của lịch sử chế độ phong kiến Việt 
Nam. Đây cũng là thời kỳ nổi dậy mạnh mẽ nhất của phong trào 
nông dân, dòng lliừi lại là lliừi kỳ có những chuyên biên quun trọng 
trong nền kinh tế của đất nước, đặc biệt là kinh tế công thương 
nghiệp và cũng là thời kỳ phát triển của nền văn hóa dân tộc trên các 
lĩnh vực văn học, sù học, y học, khoa học quân sự...
Các bộ thông sử lớn của Việt Nam từ trước tới nay đã đề cập 
nhiều tới giai đoạn lịch sử từ thế kỷ XVII đến thế kỷ XVIII:
- Từ những năm 80 của thế kỷ XX trờ về trước, giới sử học 
Việt Nam đã đặt thời kỳ lịch sử này nằm trong một giai đoạn lịch 
sử dài từ thế kỷ XVI đến giữa thế kỷ XIX và coi chung đó là thời 
kỳ suy vong và sụp đổ của chế độ phong kiến dân tộc.
19","[Page 20] LỜI NÓI ĐẦU Lịch sử Việt Nam, tập 4: từ thế kỷ XVII đến thế kỷ XVIII là cuốn thứ 4 trong bộ thông sử nhiều tập, tiếp theo cuốn thứ 3 - Lịch sừ Việt Nam, tập 3: từ thể kỳ XV đen thể kỷ XVI. Cuốn này được bắt đầu từ sau sự kiện triều Mạc bị đổ (1592) đến hết triều Tây Son (1802), trước triều Nguyễn. Đây là tập sách viết về toàn bộ diễn biến lịch sù của đất nước trên các mặt: chính trị - xã hội, kinh tế và văn hóa trong hai thế kỷ XVII và XVIII. Thế kỷ XVII-XVIII là giai đoạn lịch sù t...",1592|1802,Tây Son|Việt Nam|Đàng Ngoài|phong trào,pymupdf,clean_text,false,đầu từ sau sự kiện triều Mạc bị đổ (1592) đến hết triều Tây Son,false,0,false,,Candidate evidence only; set relevance=1 only after manual verification.|manual review required
Q0023,Vai trò hoặc hành động của Việt Nam được tài liệu mô tả như thế nào?,Tài liệu mô tả vai trò hoặc hành động của Việt Nam như thế nào?,person_entity,medium,D005,D005_P0020,20,D005_C0012,"[Page 20]
LỜI NÓI ĐẦU
Vấn đề lịch sử Việt Nam thời Nguyễn hay lịch sử Việt Nam 
giai đoạn nửa đầu thế kỷ XIX từ lâu đã được các nhà nghiên cứu 
trong và ngoài nước quan tâm chú ý với mục đích nghiên cứu phục 
dựng lại một giai đoạn lịch sừ có tính chất ""bản lề"" từ thời trung đại 
sang thời cận đại, trước khi nước ta bị thực dân Pháp xâm lược.
Trong chương trình biên soạn bộ thông sử 15 tập cùa Viện Sừ học, 
chúng tôi được giao nhiệm vụ nghiên cứu, biên soạn tập V (Lịch sử 
Việt Nam từ năm 1802 đến năm 1858) - tập cuối cùng về thời kỳ 
lịch sử cổ trung đại Việt Nam.
Mục tiêu đã được chúng tôi xác định ngay từ đầu và quán triệt 
trong suốt quá trình thực hiện, đó là: nghiên cứu và biên soạn cuốn 
Lịch sử Việt Nam từ năm 1802 đến năm 1858 một cách có hệ thống 
và toàn diện để trình bày dưới dạng thông sử.
Cuốn sách được giới hạn trong niên đại từ 1802 đến 1858 tức là 
từ khi vương triều Nguyễn được thành lập đến thời điểm thực dân 
Pháp chính thức nổ súng m ỡ đầu cuộc xâm lirợe Việt Nam.
Cuốn sách được chia làm 10 chuơng với nội dung như sau:
Chương I: Triều Nguyễn thiết lập nhà nước quân chủ chuyên chế.
Chương II: Hệ thống quản lý hành chính các địa phương.
Chương III: Tổ chức hành chính, xã hội và chính sách của nhà 
nước đối với làng xã.
Chương IV: Chế độ ruộng đất và kinh tế nông nghiệp.
Chưcmg V: Công nghiệp và thủ công nghiệp.
Chương Vỉ.ầ Thương nghiệp.
19","[Page 20] LỜI NÓI ĐẦU Vấn đề lịch sử Việt Nam thời Nguyễn hay lịch sử Việt Nam giai đoạn nửa đầu thế kỷ XIX từ lâu đã được các nhà nghiên cứu trong và ngoài nước quan tâm chú ý với mục đích nghiên cứu phục dựng lại một giai đoạn lịch sừ có tính chất ""bản lề"" từ thời trung đại sang thời cận đại, trước khi nước ta bị thực dân Pháp xâm lược. Trong chương trình biên soạn bộ thông sử 15 tập cùa Viện Sừ học, chúng tôi được giao nhiệm vụ nghiên cứu, biên soạn tập V (Lịch sử Việt Nam từ năm 1802 đến...",1802|1858,Việt Nam|Viện Sừ|Triều Nguyễn,pymupdf,clean_text,false,Vấn đề lịch sử Việt Nam thời Nguyễn hay lịch sử Việt Nam,false,0,false,,Candidate evidence only; set relevance=1 only after manual verification.|manual review required
Q0029,Vai trò hoặc hành động của Việt Nam được tài liệu mô tả như thế nào?,Tài liệu mô tả vai trò hoặc hành động của Việt Nam như thế nào?,person_entity,medium,D006,D006_P0020,20,D006_C0011,"[Page 20]
LỜI NÓI ĐẦU
Lịch sử Việt Nam từ năm 1858 đến năm 1896 là một giai đoạn 
ràt đặc biệt, giai đoạn thực dân Pháp tiến hành quá trình xâm lược 
Việt Nam.
Từ trước đèn nay đã có rất nhiều công trình cả ỡ trong và 
ngoài nước dưới nhiều góc độ khác nhau đã giới thiệu một cách khá 
cặn kẽ và đa diện về giai đoạn này. Những công trình đó dựa trên 
nhiều nguồn tư liệu, tài liệu khác nhau, với những chủ đích không 
giống nhau nên các quan điểm được đưa ra không đồng nhất trong 
nhiều vấn đề, thậm chí có khi còn trái ngược nhau. Chính vì vậy, 
khi nhận thực hiện đề tài này trong hệ thống chương trình Lịch sử 
Việt Nam (gồm 15 tập), chúng tôi gặp rất nhiều khó khăn và cũng 
rất băn khoăn trước những kết quà đã có, bời vì:
Thứ nhất, các nguồn tài liệu để tiếp cận vấn đề này hầu như 
đã được khai thác cạn kiệt. Thêm vào đó, các nguồn tư liệu lại rất 
đa dạng, nếu đi sâu vào SO sánh sẽ thấy sự khác biệt nhau về địa 
điêm, thời gian, sự kiện, địa danh, số liệu thống kê... Việc xác 
minh một cách khoa học sự ""vênh nhau” trong các nguồn tài liệu là 
một quá trình lâu dài.
Thứ hai, các vấn đề đưa ra dưới góc độ lý thuyết đều đã được 
giải quyết tương đối trọn vẹn, trong đó vấn đề đánh giá âm mưu 
của thực dân Pháp trong công cuộc xâm lược nước ta, vấn đề đánh 
giá thái độ của triều Nguyễn trước nạn ngoại xâm, vấn đề kháng 
chiến của quan quân triều đình Huế với sự SO sánh lực lượng, vũ 
khí, khí tài, quân sự giữa hai bên khá chênh lệch, vấn đề khởi nghĩa 
chông thực dân xâm lược cùa toàn thể nhân dân Việt Nam... đều đã 
được giải quyết trong rất nhiều công ừình khác nhau. Ví dụ, vấn đề","[Page 20] LỜI NÓI ĐẦU Lịch sử Việt Nam từ năm 1858 đến năm 1896 là một giai đoạn ràt đặc biệt, giai đoạn thực dân Pháp tiến hành quá trình xâm lược Việt Nam. Từ trước đèn nay đã có rất nhiều công trình cả ỡ trong và ngoài nước dưới nhiều góc độ khác nhau đã giới thiệu một cách khá cặn kẽ và đa diện về giai đoạn này. Những công trình đó dựa trên nhiều nguồn tư liệu, tài liệu khác nhau, với những chủ đích không giống nhau nên các quan điểm được đưa ra không đồng nhất trong nhiều vấn đề, thậm ch...",1858|1896,Việt Nam,pymupdf,clean_text,false,Lịch sử Việt Nam từ năm 1858 đến năm 1896 là một giai đoạn,false,0,false,,Candidate evidence only; set relevance=1 only after manual verification.|manual review required
Q0034,Vai trò hoặc hành động của Việt Nam được tài liệu mô tả như thế nào?,Tài liệu mô tả vai trò hoặc hành động của Việt Nam như thế nào?,person_entity,medium,D008,D008_P0020,20,D008_C0013,"[Page 20]
LỊCH SỪ VIỆT NAM - TẬP 8
khai thác được khá lớn. Tuy nhiên, nguồn tài liệu này có đặc điểm là 
khá tản mạn nên các tác giả phải nhiều công chắt lọc và tổng hợp mới 
có thể sử dụng được.
về các ấn phẩm, ngoài những ấn phẩm mang tính chất tài liệu, 
như những tập san niên giám hay báo chí các loại đề cập đến nhiều 
khía cạnh khác nhau của đề tài, được khai thác ở các trung tâm lưu 
trữ, các thư viện, còn nhiều công trình nghiên cứu của các học giả 
người Pháp được công bố ngay trong giai đoạn 1919-1930 hay xa 
hơn một chút - trước năm 1945. Mặt khác, phải kể tới những công 
trình nghiên cứu có giá trị tham khảo cao của các học giả nổi tiếng 
người Việt, người Pháp, người Mỹ, người Anh... được công bố trong 
thời gian từ sau năm 1945 đến nay. Trong đó, một số học giả đã được 
nói tới trong Lời nói đầu của cuốn Lịch sử Việt Nam tập 7.
Nguồn tài liệu phong phú đó đã tạo nhiều thuận lợi cho việc tạo 
dựng công trình, giải quyết ngọn ngành mỗi khía cạnh bên quan, bót 
đi tình trạng tư biện, lấy suy diễn lôgích thay cho sử liệu, nâng cao giá 
trị tham khảo cùa công trình. Tuy nhiên, điều này cũng đòi hỏi các tác 
giả phải cố gắng để không bị sa đà, biến công bình thành tập hợp 
những chuyên đề riêng rẽ. Hcm nữa, mặc dù rất phong phú, nhưng 
nguồn tài liệu đố vẫn còn chưa đủ để cho phép giải quyết dứt điểm 
mọi vấn đề liên quan đến giai đoạn lịch sử này. Chúng tôi hy vọng sẽ 
hội đủ những điều kiện, nhất là điều kiện về tài liệu tham khảo, để làm 
sáng tỏ những vấn đề chưa được giải quyết dứt điểm trong một công 
binh khác.
Cuốn Lịch sử Việt Nam từ năm 1919 đến năm 1930, tập 8 được trình 
bày thành 9 chương, không bao gồm phần Lời nói đầu và phần Kết 
luận, do 3 tác giả thực hiện là:
1. PGS.TS. Tạ Thị Thuý là chủ biên công trình, biên soạn từ 
chương I đến chương V và các phần Lời nói đầu, Kết luận, Tài liệu tham 
khảo và thư mục sách;
2. PGS. Ngô Văn Hòa biên soạn chương VI và VII;
3. PGS. Vũ Huy Phúc biên soạn chương v in và IX.
20","[Page 20] LỊCH SỪ VIỆT NAM - TẬP 8 khai thác được khá lớn. Tuy nhiên, nguồn tài liệu này có đặc điểm là khá tản mạn nên các tác giả phải nhiều công chắt lọc và tổng hợp mới có thể sử dụng được. về các ấn phẩm, ngoài những ấn phẩm mang tính chất tài liệu, như những tập san niên giám hay báo chí các loại đề cập đến nhiều khía cạnh khác nhau của đề tài, được khai thác ở các trung tâm lưu trữ, các thư viện, còn nhiều công trình nghiên cứu của các học giả người Pháp được công bố ngay trong giai đo...",1919|1930|1945,Việt Nam|Cuốn Lịch|Tạ Thị Thuý|Ngô Văn Hòa|Vũ Huy Phúc,pymupdf,clean_text,false,NEEDS_MANUAL_ANSWER,false,0,false,,Candidate evidence only; set relevance=1 only after manual verification.|manual review required
