qid,original_question,suggested_rewritten_question,question_type,difficulty,doc_id,page_id,page_number,chunk_id,evidence_text,evidence_text_short,years_detected,entities_detected,extraction_method,quality_flag,ocr_needed,proposed_answer,keep_for_benchmark,relevance,verified,labeler,notes
Q0017,Nguyên nhân hoặc hệ quả nào được nêu liên quan đến phong trào?,Nguyên nhân hoặc hệ quả nào được tài liệu nêu liên quan đến phong trào?,cause_effect,hard,D004,D004_P0020,20,D004_C0012,"[Page 20]
LỜI NÓI ĐẦU
Lịch sử Việt Nam, tập 4: từ thế kỷ XVII đến thế kỷ XVIII là
cuốn thứ 4 trong bộ thông sử nhiều tập, tiếp theo cuốn thứ 3 - Lịch 
sừ Việt Nam, tập 3: từ thể kỳ XV đen thể kỷ XVI. Cuốn này được bắt 
đầu từ sau sự kiện triều Mạc bị đổ (1592) đến hết triều Tây Son 
(1802), trước triều Nguyễn. Đây là tập sách viết về toàn bộ diễn 
biến lịch sù của đất nước trên các mặt: chính trị - xã hội, kinh tế và 
văn hóa trong hai thế kỷ XVII và XVIII.
Thế kỷ XVII-XVIII là giai đoạn lịch sù tương đối đặc biệt Uong 
tiến trình phát triển của lịch sù Việt Nam thời cổ Trung đại. Đó là 
thời kỳ chiến tranh phân liệt giữa các tập đoàn phong kiến, thời kỳ 
đất nước bị chia cắt làm hai miền với hai chế độ chính trị khác nhau: 
vua Lê - chúa Trịnh ở Đàng Ngoài và chúa Nguyễn ở Đàng Trong, 
hình thành nên một thể chế lưỡng đầu; Vua và Chúa cùng điều hành 
chính sự - sản phẩm đặc biệt của lịch sử chế độ phong kiến Việt 
Nam. Đây cũng là thời kỳ nổi dậy mạnh mẽ nhất của phong trào 
nông dân, dòng lliừi lại là lliừi kỳ có những chuyên biên quun trọng 
trong nền kinh tế của đất nước, đặc biệt là kinh tế công thương 
nghiệp và cũng là thời kỳ phát triển của nền văn hóa dân tộc trên các 
lĩnh vực văn học, sù học, y học, khoa học quân sự...
Các bộ thông sử lớn của Việt Nam từ trước tới nay đã đề cập 
nhiều tới giai đoạn lịch sử từ thế kỷ XVII đến thế kỷ XVIII:
- Từ những năm 80 của thế kỷ XX trờ về trước, giới sử học 
Việt Nam đã đặt thời kỳ lịch sử này nằm trong một giai đoạn lịch 
sử dài từ thế kỷ XVI đến giữa thế kỷ XIX và coi chung đó là thời 
kỳ suy vong và sụp đổ của chế độ phong kiến dân tộc.
19","[Page 20] LỜI NÓI ĐẦU Lịch sử Việt Nam, tập 4: từ thế kỷ XVII đến thế kỷ XVIII là cuốn thứ 4 trong bộ thông sử nhiều tập, tiếp theo cuốn thứ 3 - Lịch sừ Việt Nam, tập 3: từ thể kỳ XV đen thể kỷ XVI. Cuốn này được bắt đầu từ sau sự kiện triều Mạc bị đổ (1592) đến hết triều Tây Son (1802), trước triều Nguyễn. Đây là tập sách viết về toàn bộ diễn biến lịch sù của đất nước trên các mặt: chính trị - xã hội, kinh tế và văn hóa trong hai thế kỷ XVII và XVIII. Thế kỷ XVII-XVIII là giai đoạn lịch sù t...",1592|1802,Tây Son|Việt Nam|Đàng Ngoài|phong trào,pymupdf,clean_text,false,đầu từ sau sự kiện triều Mạc bị đổ (1592) đến hết triều Tây Son,false,0,false,,Candidate evidence only; set relevance=1 only after manual verification.|manual review required
Q0043,Nguyên nhân hoặc hệ quả nào được nêu liên quan đến Cách mạng?,Nguyên nhân hoặc hệ quả nào được tài liệu nêu liên quan đến Cách mạng?,cause_effect,hard,D009,D009_P0020,20,D009_C0013,"[Page 20]
LỊCH SỪ VIỆT NAM - TẬP 9
hình thái chiến tranh cách mạng ớ Việt Nam đế giải thích nguyên 
nhân đưa đến thang lợi của cuộc Cách mạng tháng Tám năm 1945.
Trên những hướng nghiên cứu đó, đã có nhũng công trình mang 
tính chat thông sử, trình bày khái quát về thời kỳ lịch sử này trên 
tất cả các khía cạnh cùa 1ĨÓ. Lại vì thời kỳ này có thế được ngắt 
thành những giai đoạn nhỏ, với những nội dung khác biệt trên các 
khía cạnh kinh tế, chính trị, xã hội... nên đã có những công trình 
chuyên biệt về một giai đoạn cụ thể nào đó, chẳng hạn như: 1930- 
1931, 1932-1935, 1936-1939, 1939-1945 hoặc gia chi riêng về lịch 
sử cùa Cách mạng tháng Tám. Cũng có những công trình chuyên 
sâu phản ánh về một phương diện, một vấn đề cụ thế, một sự kiện 
cụ the hoặc tại một địa phương cụ thế nào đó trong trường đoạn 
lịch sử này, được trình bày và công bo dưới những hình thức rắt 
phong phú, đa dạng.
Điều đó nói lên rằng chúng tôi đã đi sau không ít người trong 
việc nghiên cứu về “Lịch sử Việt Nam 1930-1945”. Đối với chúng 
tôi, đó vừa là một thuận lợi, vừa là một thách thức. Thuận lợi là vì 
chúng tôi được thừa hưởng kết quả cùa những công trình nghiên 
cứu phong phú kia. Còn thách thức thì là vì chính sự phong phú 
cùa các công trình đã công bo đặt chúng tôi trước một thực té là dù 
chi muốn làm ""khác đi"" một chút thôi công trình của mình so với 
những công trình trước cũng đòi hỏi phải cố gắng rất nhiều trong 
cả việc bố sung thêm nguồn tài liệu tham khảo lẫn như trong 
phương pháp tiếp cận và giải quyết vấn đề.
Trên thực tế, về tài liệu tham kháo, chúng tôi chú ý đến cà hai 
nguồn: nguồn các an phấm và nguồn tài liệu lưu trữ.
Ve các an phẩm, bên cạnh những công trình cùa các học giã 
trong nước, trong đó có những công trình cùa các nhà sừ học có 
tên tuổi, được sưu tầm tại các thư viện ở cả trung ương cũng như ở 
các địa phương, chúng tôi còn bằng nhiều cách thu gom được 
không ít công trình nghiên cứu cùa các học giả nước ngoài, được 
công bo dưới dạng các cuốn sách đồ sộ, các luận án tiến sì lịch sử, 
các luận văn cao học và các bài viết được công bố trên các tạp chí
20","[Page 20] LỊCH SỪ VIỆT NAM - TẬP 9 hình thái chiến tranh cách mạng ớ Việt Nam đế giải thích nguyên nhân đưa đến thang lợi của cuộc Cách mạng tháng Tám năm 1945. Trên những hướng nghiên cứu đó, đã có nhũng công trình mang tính chat thông sử, trình bày khái quát về thời kỳ lịch sử này trên tất cả các khía cạnh cùa 1ĨÓ. Lại vì thời kỳ này có thế được ngắt thành những giai đoạn nhỏ, với những nội dung khác biệt trên các khía cạnh kinh tế, chính trị, xã hội... nên đã có những công trình chuyên biệ...",1930|1931|1932|1935|1936|1939|1945,Việt Nam|Cách mạng,pymupdf,clean_text,false,NEEDS_MANUAL_ANSWER,false,0,false,,Candidate evidence only; set relevance=1 only after manual verification.|manual review required
Q0052,Nguyên nhân hoặc hệ quả nào được nêu liên quan đến kháng chiến?,Nguyên nhân hoặc hệ quả nào được tài liệu nêu liên quan đến kháng chiến?,cause_effect,hard,D010,D010_P0020,20,D010_C0013,"[Page 20]
LỊCH SỬ VIỆT NAM - TẬP 10
đã thi hành chính sách đổi nội, đối ngoại vừa mềm dẻo, lỉnh hoạt 
vừa nguyên tắc, kiên định đã tùng bước thay đoi được tương quan 
lực lượng và giành được những thắng lợi rất quan trọng có ý nghĩa 
rất quyết định. Sự kiện Trung Quốc, Liên Xô và các nước dân chù 
nhân dân khác công nhận nền độc lập cùa Việt Nam, đặt quan hệ 
ngoại giao với nước Việt Nam dân chù cộng hòa vào đầu năm 
1950, đặc biệt là Chiến thắng Biên giới Thu - Đông năm 1950 đập 
tan các căn cứ chiếm đóng của địch, khai thông vùng căn cứ địa 
Việt Bắc với the giới bên ngoài đã chấm dứt tình trạng bị cô lập 
cùa nước Việt Nam dân chủ cộng hòa. Một cục diện mới (về chính 
trị, quân sự, ngoại giao...) đã mở ra. Do đó, không chi phía Việt 
Nam dân chù cộng hòa có sự chuyển hướng trong đường loi chì 
đạo kháng chiến, mà cả phía Pháp với nguỵ quyển, nguỵ quân cũng 
đã phải để ra những đối sách mới để ứng phó với tình hình mới. Từ 
tháng 8/1945 đến cuối năm 1950, 13 đời Thủ tướng Pháp với nhiều 
kế hoạch xâm lược Việt Nam như Ke hoạch D'Argenlieu, Ke hoạch 
Leclerc, Ke hoạch Revers đã không xoay chuyển được tình hình và 
cuối năm 1950 phải chuyển sang một ké hoạch mới do Turómg De 
Lattre de Tassigny, Cao uỷ Tổng chi huy quân đội Pháp ở Đông 
Dương phụ trách.
Như vậy là đến cuối năm ỉ950, cả hai lực lượng song song tồn 
tại ở Việt Nam (lực lượng cùa nước Việt Nam dân chù cộng hòa - 
một ntỉớc đã được phe xã hội chù nghĩa công nhận và lực lượng 
thân Pháp đang được một sổ nước đế quốc như Mỹ, Anh ùng hộ) 
đều chuyển sang một giai đoạn mới trong cuộc đấu tranh một mất 
một còn để giành giật vai trò là người đại diện đích thực trên đất 
nước Việt Nam.
Giai đoạn lịch sử 1945-1950 chứa đựng nhiều sự kiện, nhiều 
vấn đề nhưng chưa được nghiên cứu một cách toàn diện và đầy đù. 
Cho đến nay, những công trình của các sử gia Việt Nam nghiên 
cứu ""phía bên kia"" một cách thật sự sâu sắc còn ít. Khôi phục lại 
một cách chân thực, khách quan diện mạo cùa Việt Nam bằng cách 
nhìn tổng thể, toàn diện cả hai phía là rất cần thiết đối với việc
20","[Page 20] LỊCH SỬ VIỆT NAM - TẬP 10 đã thi hành chính sách đổi nội, đối ngoại vừa mềm dẻo, lỉnh hoạt vừa nguyên tắc, kiên định đã tùng bước thay đoi được tương quan lực lượng và giành được những thắng lợi rất quan trọng có ý nghĩa rất quyết định. Sự kiện Trung Quốc, Liên Xô và các nước dân chù nhân dân khác công nhận nền độc lập cùa Việt Nam, đặt quan hệ ngoại giao với nước Việt Nam dân chù cộng hòa vào đầu năm 1950, đặc biệt là Chiến thắng Biên giới Thu - Đông năm 1950 đập tan các căn cứ chi...",1945|1950,Liên Xô|Việt Nam|Việt Bắc|Turómg De Lattre|Đông Dương|kháng chiến|độc lập,pymupdf,clean_text,false,"Sự kiện Trung Quốc, Liên Xô và các nước dân chù",false,0,false,,Candidate evidence only; set relevance=1 only after manual verification.|manual review required
Q0061,Nguyên nhân hoặc hệ quả nào được nêu liên quan đến Cách mạng?,Nguyên nhân hoặc hệ quả nào được tài liệu nêu liên quan đến Cách mạng?,cause_effect,hard,D011,D011_P0020,20,D011_C0013,"[Page 20]
LỊCH SỪ VIỆT NAM - TẬP 11
Cuộc kháng chiến chổng thực dân Pháp của nhân dân Việt Nam 
phát triển, lớn mạnh qua từng giai đoạn. Sau Cách mạng tháng 
Tám, Việt Nam từ chỗ bị bao vây; ngân sách trống rỗng, kinh tế bị 
tàn phá, nghèo nàn, lạc hậu; lực lượng vũ trang còn nhỏ bé, thiếu 
kinh nghiệm, trang thiết bị lạc hậu, qua năm tháng xây dựng và 
tranh đấu đã từng bưóc tnrởng thành và lớn mạnh. Nền kinh tế đủ 
cung cấp cho kháng chiến, lực lượng vôi trang nhân dân ngày càng 
chính quy, hiện đại đủ sửc đánh và thắng trong các chiến dịch quân 
sự lớn làm thay đổi cục diện chiến tranh như chiến dịch Biên Giới, 
Hòa Bình, Tây Bắc, Thượng Lào... và nhất là chiến dịch lịch sử 
Điện Biên Phủ đưa đến việc ký kết Hiệp định Gicmevơ chấm dứt 
chiến tranh, lập lại hòa bình ở Việt Nam năm 1954.
Đánh giá ý nghĩa thắng lợi của cuộc kháng chiến chống Pháp, 
Chủ tịch Hồ Chí Minh đã chi rõ, đây là “lần đầu tiên trong lịch sừ, 
một nước thuộc địa nhỏ yếu đã đảnh thắng một nước thực dân 
hùng mạnh. Đó là một thắng lợi vẻ vang cùa nhân dân Việt Nam, 
đồng thời cũng là một thăng lợi cùa các lực lượng hòa bình, dân 
chù và chù nghĩa xã hội trên thế giớĩ'1.
Lịch sử Việt Nam từ nỉm 1951 đến nSm 1954 nhằm giới thiệu 
một cách chân thực, khách quan, toàn diện và hệ thống từ âm mưu, 
kế hoạch xâm lược và thống trị của đế quốc Pháp - Mỹ trong cuộc 
chiến tranh, đến chủ trương, đường lối của Đảng và quá trình đấu 
tranh anh dũng của quân đội và nhân dân Việt Nam trong những 
năm cuối của cuộc kháng chiến chống thực dân Pháp trên tất cả các 
mặt từ chính trị, kinh tế, quân sự, ngoại giao, văn hóa...
Cồng trình này do nhóm tác giả Viện Sử học biên soạn:
- PGS.TS. Nguyễn Văn Nhật: Lời nói đầu, Chương VI, Kết luận 
và Tài liệu tham khảo
- TS. Đỗ Thị Nguyệt Quang: Chương I, Chương II và Chương m
- PGS.TS. Đinh Quang Hải: Chương IV và Chương V
1. Hồ Chí Minh, Toàn tập, tập 10, Nxb. Chính trị quốc gia, Hà Nội, 1996, tr. 12.","[Page 20] LỊCH SỪ VIỆT NAM - TẬP 11 Cuộc kháng chiến chổng thực dân Pháp của nhân dân Việt Nam phát triển, lớn mạnh qua từng giai đoạn. Sau Cách mạng tháng Tám, Việt Nam từ chỗ bị bao vây; ngân sách trống rỗng, kinh tế bị tàn phá, nghèo nàn, lạc hậu; lực lượng vũ trang còn nhỏ bé, thiếu kinh nghiệm, trang thiết bị lạc hậu, qua năm tháng xây dựng và tranh đấu đã từng bưóc tnrởng thành và lớn mạnh. Nền kinh tế đủ cung cấp cho kháng chiến, lực lượng vôi trang nhân dân ngày càng chính quy, hiện đ...",1951|1954|1996,Việt Nam|Sau Cách|Điện Biên Phủ|Hồ Chí Minh|Viện Sử|Nguyễn Văn|Đỗ Thị Nguyệt|Đinh Quang|Hồ Chí|Cách mạng|kháng chiến|hiệp định|chiến dịch|thuộc địa,pymupdf,clean_text,false,LỊCH SỪ VIỆT NAM - TẬP 11,false,0,false,,Candidate evidence only; set relevance=1 only after manual verification.|manual review required
Q0070,Nguyên nhân hoặc hệ quả nào được nêu liên quan đến cải cách?,Nguyên nhân hoặc hệ quả nào được tài liệu nêu liên quan đến cải cách?,cause_effect,hard,D012,D012_P0020,20,D012_C0011,"[Page 20]
LỊCH SỬ VIỆT NAM - TẬP 12
Ngay sau khi Hiệp định Giơnevơ được ký kết và hòa bình lập 
lại trên đất nước Việt Nam, nhân dân miền Bac đã ra sức lao động 
sàn xuất, hàn gắn vết thương chiến tranh, khôi phục và phát triển 
kinh tế, văn hóa, tăng cường giao lưu và mở rộng quan hệ quốc tế 
trên tinh thần tôn trọng độc lập, chủ quyền của nhau. Nhân dân miền 
Bắc không có nguyện vọng nào hơn là xây dựng cuộc sống ấm no, 
hạnh phúc và nguyện cùng nhân dân miền Nam đấu tranh cho sự 
nghiệp hòa bình, thống nhất Tổ quốc để tiến tới một nước Việt Nam 
hòa bình, thống nhất độc lập, dân chủ và giàu mạnh.
Dù có một số khó khăn do những sai lầm trong quá trình thực 
hiện cuộc cải cách ruộng đất và xử lý vụ ""Nhân văn Giai phâm"" 
trong khoảng thời gian từ năm 1955 đến năm 1957 nhưng nhờ có 
đường lối đúng của Đảng và Nhà nước bộ mặt miền Bắc dã có sự 
đổi khác, nhiều nhà máy, công trường, bệnh viện, trường học mọc 
lên, tạo nên cuộc sống vui tươi, đầm ấm nơi bàn làng, thôn xóm, 
phố thị. Ke hoạch 5 năm lần thứ nhất (1961-1965) mở ra những 
khát vọng có được một cuộc sống no đủ hơn...
Trong khi đó, ờ miền Nam, chính quyền Sài Gòn được Mỹ - vừa 
là ngirời chủ mưu, vừa là kè đồng lõa trắng trợn phá hoại Hiệp định 
Giơnevơ - dùng súng đạn và các thủ đoạn lừa mị, ngang nhiên 
chống lại nguyện vọng thiêng liêng hòa bình thống nhất đất nước 
của nhân dân hai miền Nam - Bắc. Chủ trương cùa Mỹ là: Không 
Ihi hành Iiiộp định Giưnevư, chia cát lâu dài nước Viộl Nam , bién 
miền Nam thành thuộc địa kiểu mới và căn cứ quân sự của Mỹ, lấy 
miền Nam làm phòng tuyến ngăn chặn chủ nghĩa xã hội lan xuống 
Đông Nam Á, đồng thời làm căn cứ để tiến công miền Bấc, bao 
vây và uy hiếp các nước xã hội chủ nghĩa, ngăn chặn phong trào 
giải phóng dân tộc đang có chiều hướng ngày càng phát triển trên 
thế giới.
Để thực hiện chủ trương này, Mỹ đã tìm cách nhanh chóng hất 
cẳng Pháp ra khỏi miền Nam, lập nên ở Sài Gòn một chính phủ thân 
Mỹ, làm theo sự chi đạo cùa Mỹ do Ngô Đình Diệm làm Thủ tướng
18","[Page 20] LỊCH SỬ VIỆT NAM - TẬP 12 Ngay sau khi Hiệp định Giơnevơ được ký kết và hòa bình lập lại trên đất nước Việt Nam, nhân dân miền Bac đã ra sức lao động sàn xuất, hàn gắn vết thương chiến tranh, khôi phục và phát triển kinh tế, văn hóa, tăng cường giao lưu và mở rộng quan hệ quốc tế trên tinh thần tôn trọng độc lập, chủ quyền của nhau. Nhân dân miền Bắc không có nguyện vọng nào hơn là xây dựng cuộc sống ấm no, hạnh phúc và nguyện cùng nhân dân miền Nam đấu tranh cho sự nghiệp hòa bình,...",1955|1957|1961|1965,Việt Nam|Sài Gòn|Không Ihi|Viộl Nam|Đông Nam|Ngô Đình Diệm|cải cách|hiệp định|phong trào|độc lập|thuộc địa,pymupdf,clean_text,false,LỊCH SỬ VIỆT NAM - TẬP 12,false,0,false,,Candidate evidence only; set relevance=1 only after manual verification.|manual review required
Q0079,Nguyên nhân hoặc hệ quả nào được nêu liên quan đến kháng chiến?,Nguyên nhân hoặc hệ quả nào được tài liệu nêu liên quan đến kháng chiến?,cause_effect,hard,D013,D013_P0021,21,D013_C0012,"[Page 21]
LỜI NÓI ĐẦU
Lịch sử Việt Nam thời kỳ 1954-1975 là lịch sử của công cuộc 
xây dựng chủ nghĩa xã hội và chiến đấu chống cuộc chiến tranh 
phá hoại của Mỹ ở miền Bắc; đồng thòi là lịch sử của cuộc kháng 
chiến trường kỳ 21 năm chống Mỹ xâm lược, giải phóng miền Nam, 
thống nhất đất nước.
Trong lịch sừ đấu tranh chống ngoại xâm của nhân dân Việt 
Nam, cuộc kháng chiến chống Mỹ, cứu nước (1954-1975) được coi 
là thừ thách lớn nhất đối với dân tộc Việt Nam từ sau thử thách 
cùa hơn nghìn năm Bắc thuộc và sau gần một trăm năm chống ách 
thống trị và chiến tranh xâm lược của thực dân Pháp.
Thắng lợi của cuộc kháng chiến chống Mỹ, cứu nước là thiên 
anh hùng ca vĩ đại nhất trong lịch sử dựng nước và giữ nước của 
nhân dân Việt Nam, đánh dấu một bước ngoặt quyết định ưong lịch 
sử dân tộc, đưa Việt Nam bước vào kỷ nguyên mới, kỷ nguyên cùa 
độc lập và xây rlựng đât rurác theo định hướng xã hội chủ nghĩu.
Trong 21 năm kháng chiến chống Mỹ, cứu nước của nhân dân 
Việt Nam, giai đoạn từ 1965 đến 1975 là giai đoạn gay go, ác liệt 
nhất, thể hiện sức mạnh quân sự và thí nghiệm các học thuyết chiến 
tranh cùa Mỹ; giai đoạn chứng tỏ sự sáng suốt trong chi đạo của 
Đàng Cộng sản, sự thông minh và ý chí kiên cường của quân đội và 
nhân dân Việt Nam, giai đoạn quyết định cùa cuộc chiến mà thắng lợi 
cuối cùng thuộc về nhân dân Việt Nam.
Trong giai đoạn này, để cứu vãn nguy cơ sụp đổ của chế độ 
""Việt Nam Cộng hòa"", cùng với việc tảng cường viện trợ về kinh tế
19","[Page 21] LỜI NÓI ĐẦU Lịch sử Việt Nam thời kỳ 1954-1975 là lịch sử của công cuộc xây dựng chủ nghĩa xã hội và chiến đấu chống cuộc chiến tranh phá hoại của Mỹ ở miền Bắc; đồng thòi là lịch sử của cuộc kháng chiến trường kỳ 21 năm chống Mỹ xâm lược, giải phóng miền Nam, thống nhất đất nước. Trong lịch sừ đấu tranh chống ngoại xâm của nhân dân Việt Nam, cuộc kháng chiến chống Mỹ, cứu nước (1954-1975) được coi là thừ thách lớn nhất đối với dân tộc Việt Nam từ sau thử thách cùa hơn nghìn năm Bắc...",1954|1965|1975,Việt Nam|Đàng Cộng|Việt Nam Cộng|kháng chiến|độc lập,pymupdf,clean_text,false,Lịch sử Việt Nam thời kỳ 1954-1975 là lịch sử của công cuộc,false,0,false,,Candidate evidence only; set relevance=1 only after manual verification.|manual review required
Q0016,Khái niệm hoặc chính sách phong trào được trình bày như thế nào trong tài liệu?,Tài liệu giải thích hoặc mô tả khái niệm/chính sách phong trào như thế nào?,policy_concept,medium,D004,D004_P0020,20,D004_C0012,"[Page 20]
LỜI NÓI ĐẦU
Lịch sử Việt Nam, tập 4: từ thế kỷ XVII đến thế kỷ XVIII là
cuốn thứ 4 trong bộ thông sử nhiều tập, tiếp theo cuốn thứ 3 - Lịch 
sừ Việt Nam, tập 3: từ thể kỳ XV đen thể kỷ XVI. Cuốn này được bắt 
đầu từ sau sự kiện triều Mạc bị đổ (1592) đến hết triều Tây Son 
(1802), trước triều Nguyễn. Đây là tập sách viết về toàn bộ diễn 
biến lịch sù của đất nước trên các mặt: chính trị - xã hội, kinh tế và 
văn hóa trong hai thế kỷ XVII và XVIII.
Thế kỷ XVII-XVIII là giai đoạn lịch sù tương đối đặc biệt Uong 
tiến trình phát triển của lịch sù Việt Nam thời cổ Trung đại. Đó là 
thời kỳ chiến tranh phân liệt giữa các tập đoàn phong kiến, thời kỳ 
đất nước bị chia cắt làm hai miền với hai chế độ chính trị khác nhau: 
vua Lê - chúa Trịnh ở Đàng Ngoài và chúa Nguyễn ở Đàng Trong, 
hình thành nên một thể chế lưỡng đầu; Vua và Chúa cùng điều hành 
chính sự - sản phẩm đặc biệt của lịch sử chế độ phong kiến Việt 
Nam. Đây cũng là thời kỳ nổi dậy mạnh mẽ nhất của phong trào 
nông dân, dòng lliừi lại là lliừi kỳ có những chuyên biên quun trọng 
trong nền kinh tế của đất nước, đặc biệt là kinh tế công thương 
nghiệp và cũng là thời kỳ phát triển của nền văn hóa dân tộc trên các 
lĩnh vực văn học, sù học, y học, khoa học quân sự...
Các bộ thông sử lớn của Việt Nam từ trước tới nay đã đề cập 
nhiều tới giai đoạn lịch sử từ thế kỷ XVII đến thế kỷ XVIII:
- Từ những năm 80 của thế kỷ XX trờ về trước, giới sử học 
Việt Nam đã đặt thời kỳ lịch sử này nằm trong một giai đoạn lịch 
sử dài từ thế kỷ XVI đến giữa thế kỷ XIX và coi chung đó là thời 
kỳ suy vong và sụp đổ của chế độ phong kiến dân tộc.
19","[Page 20] LỜI NÓI ĐẦU Lịch sử Việt Nam, tập 4: từ thế kỷ XVII đến thế kỷ XVIII là cuốn thứ 4 trong bộ thông sử nhiều tập, tiếp theo cuốn thứ 3 - Lịch sừ Việt Nam, tập 3: từ thể kỳ XV đen thể kỷ XVI. Cuốn này được bắt đầu từ sau sự kiện triều Mạc bị đổ (1592) đến hết triều Tây Son (1802), trước triều Nguyễn. Đây là tập sách viết về toàn bộ diễn biến lịch sù của đất nước trên các mặt: chính trị - xã hội, kinh tế và văn hóa trong hai thế kỷ XVII và XVIII. Thế kỷ XVII-XVIII là giai đoạn lịch sù t...",1592|1802,Tây Son|Việt Nam|Đàng Ngoài|phong trào,pymupdf,clean_text,false,Đây cũng là thời kỳ nổi dậy mạnh mẽ nhất của phong trào,false,0,false,,Candidate evidence only; set relevance=1 only after manual verification.|manual review required
